NOV,Nombre,Sexo,Carrera,Nota,Resultado,CUI,Fecha aprobacion
2018007147,FLORES BARRONDO AXEL JAVIER,1,1,10,Aprobado,3006315450101,05/10/2018
2018025652,LAVAGNINO GONZALEZ ALESSANDRO ,1,1,12,Aprobado,3693991290101,05/10/2018
2018029601,LAM LEIVA MARCELO ,1,1,9,Aprobado,3034340580108,05/10/2018
2018052898,ELI SAUL DE PAZ ALDANA,1,1,18,Aprobado,2064343590101,05/10/2018
2018019793,ALVARADO MERIDA HUGO ALFREDO,1,1,21,Aprobado,2999541880101,05/10/2018
2016020206,ARANA VANEGAS ALAN ELIAS,1,1,14,Aprobado,3360773001701,05/10/2018
2010027097,ORDOÑEZ CASTELLON JOSE FRANCISCO,1,2,11,Aprobado,2159500890101,05/10/2018
2017018486,VICTOR MANUEL ZAMORA SANTIZO,1,2,16,Aprobado,3004654160101,19/10/2017
